ID,Category,Title,Status,Owner,Effort,Updated,Notes
W19-STATUS-TRACKER,Wave 5.5,Canonical STATUS tracker as harness primitive (src/harness/status/ + harness status CLI verbs),shipped,Kimi+Claude,~45 min,2026-05-21,Commit 514945f; hybrid Kimi-CLI partial + Claude inline; 305/305 tests; 90% coverage
W20-OBSERVER,Wave 5.6,Independent observer primitive (the check on dev-manager authority),shipped,Kimi via swarm,~60 min,2026-05-21,Kimi-CLI landed 6 module files (state/scheduler/cycle/audit_prompt/flags/__init__) + tests/test_observer.py (22KB; 41 tests) + cli.py observer group (12 subcommands) + manager.md Step 0 during 1200s timeout per feedback_kimi_cli_incremental_edits. Claude removed obsolete observer_tick stub test. 346/346 tests pass; 79% coverage on harness.observer.
WA-1,Wave A,Wire dispatch CLI verb to dispatch_packet,shipped,Claude,30 min,2026-05-20,"Commit 8b65dde; first wired verb, set pattern"
WA-2,Wave A,Wire remaining 10 CLI verbs (init/status/engines/priority/burst/lock/observer-tick/retro/install/dashboard-serve/loops),shipped,Kimi via swarm,~30 min wall,2026-05-20,Commit d5def26; 24 new tests
WA5,Wave A.5,HarnessError taxonomy module + spec + tests,shipped,Claude,~1 hr,2026-05-20,errors.py + spec/errors.md + 21 tests; 89/89 pass
WA6,Wave A.6,Retrofit operational raises to HarnessError subclasses,shipped,Claude,30 min,2026-05-20,Scope narrowed to 4 raises in dpapi+jsonl_log; Pydantic/user-input/contract raises kept as ValueError
WB-CI,Wave B,GitHub Actions test workflow,shipped,Claude,15 min,2026-05-20,.github/workflows/test.yml; ubuntu+windows matrix; py3.13
WB-CONCRETE,Wave B/1,Boundary tests for engines/concrete.py,shipped,Kimi via swarm,~10 min,2026-05-20,459 lines; coverage 20%→84%; landed despite swarm timeout tag (incremental-edit pattern)
WB-GUARDS,Wave B/2,Boundary tests for engines/guards.py,shipped,Kimi via swarm,~10 min,2026-05-20,478 lines; coverage 39%→100%
WB2-DPAPI,Wave B/2,Boundary tests for secrets/dpapi.py,shipped,Kimi via swarm,unknown,2026-05-20,Dispatched 14:12Z swarm bpmoktqtv; commit d6acc1f; landed via incremental Kimi-CLI edits
WB2-STATE-FILES,Wave B/2,Boundary tests for state/files.py,shipped,Kimi via swarm,unknown,2026-05-20,Same swarm; commit 0a7a0f5; landed via incremental Kimi-CLI edits
WB2-STATE-DB,Wave B/2,Boundary tests for state/db.py,shipped,Kimi via swarm,unknown,2026-05-20,Same swarm; commit d1e8f92; landed via incremental Kimi-CLI edits
WB2-STATE-JSONL,Wave B/2,Boundary tests for state/jsonl_log.py,shipped,Kimi via swarm,unknown,2026-05-20,In swarm queue (max-concurrent 3); commit f010ecf; landed via incremental Kimi-CLI edits
WB2-CLI-HELPERS,Wave B/2,Boundary tests for cli_helpers.py,shipped,Kimi via swarm,unknown,2026-05-20,In swarm queue; commit 34c920b; landed via incremental Kimi-CLI edits
W4,Wave 4,Windows installer + first-run wizard,shipped,Kimi+Claude,~2 hr,2026-05-20,4 files + dpapi __main__; landed despite swarm timeout tag; 171/171 then 185/185 pass
W7A,Wave 7/A,Operator-modes foundation (operator/* module + 14 tests),shipped,Claude,45 min,2026-05-20,Inline after 2 swarm/kimi attempts failed on too-broad packet
W7B,Wave 7/B,Operator-modes CLI integration (apply_operator_flags + dispatch dry_run),shipped,Claude,20 min,2026-05-20,7 new flags on @cli.group; dry_run mode works end-to-end
W7C,Wave 7/C,Operator-modes polish (schema OperatorSection + init verb operator: YAML emission),shipped,Kimi via swarm,~30 min,2026-05-21,Side-effect of Round 3: Kimi added OperatorSection to schema.py + threaded into AdapterConfig as optional operator: field + init verb emits operator: YAML for solo-dev (mode=full_dev_authority verified)
W5-PACKETS,Wave 5,"Wave 5 split into 5/A (templates) + 5/B (NL→YAML), both packets drafted",shipped,Claude,30 min,2026-05-20,Commit bd26470; both packets ready to dispatch when swarm slot opens
W5A,Wave 5/A,Template refresh: add operator: section to all 6 templates,shipped,Kimi via swarm,~10 min,2026-05-21,Kimi-CLI landed 6 templates (adapters/templates/*.yaml) with operator: section per spec/wave-5-templates-nl-yaml.md; 369/369 tests; templates load + validate cleanly
W5B,Wave 5/B,NL→YAML translator + harness adapter verb group,shipped,Kimi via swarm,~30 min,2026-05-21,Kimi-CLI landed src/harness/adapters/from_description.py + _nl_to_yaml_prompt.md + tests/test_adapter_from_description.py + cli.py adapter group (from-description/list/validate); 23 new tests
W3,Wave 3,Dashboard backend + frontend (FastAPI + WebSocket),shipped,Kimi+Claude,multi-day,2026-05-21,Commit 71225ad; Kimi autonomously committed 9 files (654 LOC) including 15 dashboard tests; 654/15 in 1200s timeout; runs clean uvicorn on 127.0.0.1:7878; WebSocket pushes every 5s
W6,Wave 6,Productize autonomous loops as harness feature,shipped,Kimi+Claude,multi-week,2026-05-21,Wave 6 shipped via 6A (core loop infra) + 6B (CLI verb group + scheduler); 478/478 tests; harness loop init/tick/start/stop/status all functional; observer-flag Step 0 integrated; TestingSupervisor mechanical; other supervisors are NoOpSupervisor placeholders (future-iteration items in feature-roster backlog)
DEV-LOOP-SCAFFOLD,Dev Loop,coord/dev_loop/ scaffolding (state.json + manager.md + 5 supervisors + dispatch-rules + escalations + log),shipped,Claude,~3 hr,2026-05-20,Prototype for Wave 6; loop running in this session
DEV-LOOP-PROCESS-IMPROVE,Dev Loop,5th supervisor: process_improvement,shipped,Claude,30 min,2026-05-20,Cadence 2h or trigger-driven; first tick produced 5 findings; 3 P1 applied
DEV-LOOP-EVENT-DRIVEN,Dev Loop,Cadence-is-the-floor / event-driven tick rule,shipped,Claude,15 min,2026-05-20,"manager.md ""What you do NOT do"" + roster row #18"
DEV-LOOP-NO-IDLE-DM,Dev Loop,Dev manager does not idle either rule,shipped,Claude,5 min,2026-05-20,Same commit; roster row #18 origin
DEV-LOOP-CALIBRATION,Dev Loop,Empirical concurrency calibration from warehouse,shipped,Claude,30 min,2026-05-20,engine_slots kimi 3→6 / kimi-api 2→6; cooldowns removed (immediate_fallback)
DEV-LOOP-STATUS-CSV,Dev Loop,Canonical STATUS.csv tracker (this file),shipped,Claude,15 min,2026-05-20,Replicated from warehouse pattern; update on every task transition
HEARTBEAT,Backlog (P2),harness heartbeat CLI verb (passive operator status),shipped,Kimi via swarm,~30 min,2026-05-21,Inline-authored by Claude after Round 4 W7C completed as Round 3 side effect; src/harness/heartbeat.py (Heartbeat schema + pulse/read/format_for_human) + cli.py heartbeat group (pulse/show) + tests/test_heartbeat.py (16 tests). 399/399 tests pass.
STATE-INSPECT,Backlog (P2),harness state inspect CLI verb (pretty-print state.json),shipped,Kimi via swarm,~30 min,2026-05-21,Inline-authored by Claude; src/harness/state/inspect.py (render_state_json + summary helpers + ConfigCorruption on bad JSON) + cli.py state group (inspect with pretty/json/compact formats) + tests/test_state_inspect.py (14 tests).
SESSION-BOOTSTRAP,Doc,Durable session-bootstrap prompt (paste-to-boot-new-Claude),shipped,Claude,30 min,2026-05-20,"coord/SESSION_BOOTSTRAP.md; recovery artifact authored by a parallel Claude session, saved + annotated with state-delta; consider Wave 6 candidate for `harness session bootstrap` CLI verb"
REPLAY-CLI,Backlog (creativity),harness replay CLI verb - decision archaeology for dispatches,shipped,Claude+Kimi,~3 hr,2026-05-21,Inline-authored after Kimi dispatch (bd00qzs71) timed out with zero edits; src/harness/replay.py (replay_dispatch + format_for_human) + cli.py replay verb + 10 tests; joins DB dispatches+fallbacks with jsonl supplement; 488/488 pass
BUDGET-METER,Backlog (parked),Dispatch budget meter + per-engine cost ledger,shipped,Claude+Kimi,~2 hr,2026-05-21,Commit b856131 (shipped); 22 tests; harness budget verb group
GEMINI-ADAPTER,Backlog (parked),Gemini 2.x engine adapter for cross-engine triangulation,shipped,Kimi,~3 hr,2026-05-21,Commit c96d6c4 (shipped); engine concrete impl + boundary tests
MEMORY-ENTRIES,Memory,6 memory entries (full-dev-authority / error-taxonomy / agentic-differences / operator-inputs-config / kimi-cli-incremental-edits / concurrency-calibration),shipped,Claude,~1 hr total,2026-05-20,All in C:/Users/xaxiu/.claude/projects/D--Projects/memory/ + indexed in MEMORY.md
CLAUDE-MD-REFRESH,Doc,CLAUDE.md refresh for current operating mode,shipped,Claude,15 min,2026-05-20,Full-dev-authority + L5 escalation + parallelism + slot-fill + memory entries to load on session start
GH-PUSH,Infra,Push to GitHub public repo,shipped,Claude,10 min,2026-05-20,xaxiuegg/xaxiu-harness; sensitivity audit clean; CI active
SSH-SETUP,Infra,SSH key-only auth + WSL+tmux remote access (parent project),shipped,operator+Claude,~2 hr,2026-05-20,Pre-dev-loop session; not part of harness scope but unlocked productivity
W6A,Wave 6/A,Core loop infrastructure (productize coord/dev_loop/),shipped,Kimi via swarm,C:\Users\45 min,2026-05-21,"Kimi-CLI landed 7 files (state/runner/supervisors/__init__/3 tests) via incremental edits; Claude fixed 5 small bugs (read_state graceful degradation, write_set in early-return, test fixtures); 462/462 tests pass; coverage TBD"
W6B,Wave 6/B,harness loop CLI verb group + Windows Task Scheduler,shipped,Claude inline,C:\Users\30 min,2026-05-21,Claude inline-authored after W6A landed; src/harness/loops/scheduler.py (register/unregister/is_registered) + cli.py loop group (init/tick/start/stop/status) + 16 new tests; 478/478 pass; mirrors observer scheduler pattern
W6C,Wave 6/C,Real supervisor implementations (productize 4 NoOp placeholders),shipped,Kimi via swarm,C:\Users\60 min,2026-05-21,"Wave 6/C landed via Kimi-CLI incremental edits (b9xt11uvy, timeout-tagged); 608 LOC added to supervisors.py (CreativitySupervisor + DevelopingSupervisor + IntegratingSupervisor + ProcessImprovementSupervisor); Claude renamed 4 obsolete *_noop tests to *_real; 526/526 tests pass"
V2A-PROXY,v2/A,Stateful 4-key API proxy with circuit breaker,shipped,Kimi via swarm,C:\Users\60 min,2026-05-21,Round 10 dispatch (b65caop83) clean exit; 8 module files + 4 test files; 45 proxy tests pass; FastAPI on localhost:7879 with circuit-breaker per-key state machine; OpenAI-compatible chat-completion proxy
V2B-SCHEMAS,v2/B,Coordinator JSON schemas + Planner module,shipped,Kimi via swarm,45 min,2026-05-21,Kimi auto-committed via bg253i8d4; 35 tests pass; schemas.py + planner.py
V2C-WORKER,v2/C,Worker + worktree + checkpoint,shipped,Kimi via swarm,45 min,2026-05-21,Kimi auto-committed as a7ef925; worker.py + worktree.py + checkpoint.py + tests
V2D-COORDINATOR,v2/D,Coordinator + Integrator + harness coord CLI,shipped,Kimi via swarm,60 min,2026-05-21,Landed via Round 12 swarm (b00j13yvt timeout-tagged); coordinator.py + integrator.py + run_state.py + cli.py coord group with 5 subcommands; 711/712 tests pass (1 windows flake)
V2-MOCK-ENGINE,Production,MockEngine adapter for offline v2 end-to-end smoke (no API keys),shipped,Kimi via swarm,45 min,2026-05-21,Landed commit 3003eeb 2026-05-21; mock excluded from auto-fallback + probes
V2-SAMPLE-SPEC,Production,Author tiny sample spec + golden plan.json for v2 smoke,shipped,Claude inline,30 min,2026-05-21,spec/samples/hello-world.md + MockEngine FILE/REPLACE alignment; commit pending
V2-FIRST-RUN,Production,First actual harness coord run end-to-end against sample spec,shipped,Claude inline,90 min,2026-05-21,tests/test_coord_smoke_e2e.py — planner+worker pipeline green via MockEngine. Caught 4 prod gaps: harness-planner/worker adapters missing; load_project_adapter no placeholder resolution; lazy init_db; ActiveDispatch.backend literal stale
COORD-WORK-WIRE,Production,Wire harness coord work CLI to actually call run_worker (stub fix),shipped,Kimi via swarm,45 min,2026-05-21,Landed commit 6bef07f 2026-05-21
WORKER-RUN-ENGINE,Production,worker.run_worker: actually invoke engine + apply edits + commit,shipped,Kimi via swarm,90 min,2026-05-21,Landed commit 6bef07f 2026-05-21
INTEGRATOR-GIT-MERGE,Production,Integrator: actually git merge worker branches (stub fix),shipped,Claude inline,45 min,2026-05-21,_merge_worker_branches honours WavePlan.integration_strategy (squash/merge); 2 real-git tests added; commit pending
COORD-WORKTREE-CREATE,Production,Coordinator.launch_workers: actually create worktrees (currently missing),shipped,Kimi via swarm,30 min,2026-05-21,Landed commit 6bef07f 2026-05-21
PROXY-AUTOSTART,Production,Auto-start proxy from harness coord run if not running on port,shipped,Kimi via swarm,30 min,2026-05-21,Kimi delivered lifecycle.py + cli.py --proxy flag + 7 tests; commit pending
ENGINE-VIA-PROXY,Production,KimiConcrete: route through localhost:7879 proxy not direct to Moonshot,shipped,Kimi via swarm,30 min,2026-05-21,Landed commit 259f0fd 2026-05-21
CHAT-OBSERVER,Observability,Chat Observer audits session transcript jsonl for dev-manager pattern drift,shipped,Kimi via swarm,90 min,2026-05-21,Kimi delivered observer/chat.py + cli observer audit-chat + 8 tests; commit pending
DASHBOARD-V2-ROUTES,Operator-UX,"Dashboard v2 routes: /runs, /runs/<id>, /workers, /proxy-state",shipped,Kimi via swarm,2 hr,2026-05-21,Kimi delivered v2_routes.py + app.py include_router + 7 tests (TestClient HTTP coverage); commit pending
OPERATOR-DIRECTIVES-PROMOTION,Operator-UX,Promote session-handoff + kill-conditions + 90/10 balance to OperatorSection YAML,shipped,Claude inline,45 min,2026-05-21,3 sub-schemas (SessionHandoffThresholds + KillConditions + ProductionHygieneBalance) added; recommender accepts HandoffThresholds; spec docs updated
ROSTER-V2-EXTEND,v2-Polish,Append rows 21-30 to feature-roster for post-Wave-6 directives,shipped,Claude inline,30 min,2026-05-21,Rows 21-30 in spec/session-derived-feature-roster.md; landed earlier this session via doc-sync subagent
COORD-LOG-STREAM,Observability,harness coord watch <run_id> CLI verb for live tail,shipped,Kimi via swarm,45 min,2026-05-21,Kimi delivered coord/watch.py + cli coord watch + 5 tests; commit pending
KILL-CONDITION-WIRING,Operator-UX,Wire --kill-on-cost + --kill-on-rows from budget meter into loop runner hard stop,shipped,Claude inline,45 min,2026-05-21,_check_kill_conditions in runner.py checks adapter operator.kill_conditions before each tick; 4 new tests; commit pending
PACKET-TEMPLATE-FANOUT-RULE,Process,Add >500-LOC / >2-symbol auto-fanout rule to packet template + dispatch-rules scope checklist,shipped,Claude inline,~45 min,2026-05-21,## Auto-fanout section added to dispatch-rules.md (4 hard signals + 3 soft signals); commit pending
WORKER-RESUME-ON-RETRY,Production,harness coord retry <worker_id> re-dispatches failed worker from last checkpoint,shipped,Kimi via swarm,60 min,2026-05-21,Kimi landed coord retry subcommand + 5 tests; commit pending
WORKER-TOKEN-COST-TAG,Production,Stamp tokens_used + dollar_cost on worker deliverable from engine result,shipped,Kimi via swarm,45 min,2026-05-21,Kimi landed worker.py accumulators + schemas.cost_usd + base.py EngineResponse fields + dispatcher wiring + 2 tests; commit pending
COORD-REPLAN-ON-FAIL,Production,harness coord replan <run_id> re-runs planner with failed-worker feedback,shipped,Claude inline,90 min,2026-05-21,planner.replan_from_run reads failed checkpoints + augments spec text with failure diagnostics; coord replan CLI verb; 5 tests; commit pending
DASHBOARD-RUN-DETAIL-PAGE,Operator-UX,Dashboard /runs/<id> HTML view with worker grid + checkpoint timeline,shipped,Kimi via swarm,90 min,2026-05-21,Kimi landed /v2/runs/<id> HTML route + _render_run_detail_html + 3 TestClient tests; commit pending
DASHBOARD-WS-V2-STREAM,Operator-UX,Extend dashboard WebSocket snapshot to include v2 runs + worker states,shipped,Kimi via swarm,45 min,2026-05-21,Kimi landed _snapshot() v2 key + 3 tests; commit pending
PROXY-ADMIN-RESET,Production,harness proxy reset-circuit + disable-key admin verbs,shipped,Kimi via swarm,45 min,2026-05-21,Verified already present in cli.py (reset-circuit + quarantine wired to harness.proxy.cli); packet was no-op as predicted
COORD-NOTIFY-ON-INTEGRATE,Integration,Post-integrate hook: write notify.json + optional webhook POST on run completion,shipped,Kimi via swarm,45 min,2026-05-21,Kimi landed coord/notify.py (write_notify + post_webhook + notify) + integrator.py wiring on success+conflict paths + 6 tests; commit pending
SPEC-FROM-NL-VERB,Operator-UX,harness coord plan-from-description "<NL>" skips markdown-spec step,shipped,Kimi via swarm,60 min,2026-05-21,Kimi landed plan_from_description helper + coord plan-from-description CLI verb + 3 tests; commit pending
WORKER-PROGRESS-STREAM,Observability,Worker writes step-level progress to checkpoints/<id>.progress.jsonl during dispatch,shipped,Kimi via swarm,45 min,2026-05-21,Kimi landed _append_progress helper + step_start/step_done/worker_done events + watch.py progress-tail integration + 4 tests; commit pending
CHAT-OBSERVER-AUTO-ARM,Observability,harness observer install-scheduler --include-chat registers chat audit on cadence,shipped,Kimi via swarm,30 min,2026-05-21,Kimi landed register_chat_audit_task + --include-chat flag + 3 tests; commit pending
ENGINE-FALLBACK-COOLDOWN-VIZ,Observability,harness engines cooldowns CLI verb + dashboard panel for active cooldown windows,shipped,Kimi via swarm,45 min,2026-05-21,Kimi landed cli engines cooldowns subcommand + 3 tests; commit pending
COORD-RUN-LIST-VERB,Operator-UX,harness coord list enumerates runs/ with state + age + size,shipped,Claude inline,30 min,2026-05-21,CLI verb calls existing list_runs() from v2_routes; 4 tests covering ordering + limit + task-count; commit pending
CLI-DECOMPOSE,Refactor,Decompose cli.py (1500 LOC) by verb group into cli/__init__.py + per-group modules,deferred,Kimi via swarm,~90 min,2026-05-21,Deferred to fresh session 2026-05-21 — high-risk refactor conflicts with every cli-touching production packet; defer until production backlog drains again
COORD-RERUN-FAILED,Failure-Recovery,harness coord rerun-failed <run_id> one-shot replan+run+integrate chain,shipped,Kimi via swarm,60 min,2026-05-21,Kimi landed coord rerun-failed CLI chaining replan_from_run → Coordinator.tick → integrate; 3 tests; commit pending
COORD-CANCEL,Failure-Recovery,harness coord cancel <run_id> graceful stop of in-flight workers,shipped,Kimi via swarm,60 min,2026-05-21,Kimi landed canceller.py + coord cancel CLI + cross-platform PID termination + tests; commit pending
WORKER-HEARTBEAT,Observability,Worker emits per-step liveness pulse to coord state for hang detection,shipped,Kimi via swarm,60 min,2026-05-21,Kimi landed _heartbeat_touch (worker.py) + detect_stalled_workers (coordinator.py) + 7 tests; commit pending
ENGINE-PROBE-QUOTA,Observability,Engine probes capture rate-limit/quota headers from responses,shipped,Claude inline,45 min,2026-05-21,probe_engine_quota + probe_all_engines_quota in cli_helpers.py; parses x-ratelimit-{limit,remaining,reset}-{requests} variants; 7 tests; commit pending
REPLAY-COORD-RUNS,Observability,Extend harness replay to surface v2 coord runs (currently dispatch-only),shipped,Kimi via swarm,60 min,2026-05-21,Kimi landed replay_coord_run + format_coord_for_human + CLI run_id routing + tests; commit pending
DASHBOARD-COST-PANEL,Operator-UX,Dashboard live cost panel: per-engine spend + budget cap progress bar,shipped,Kimi via swarm,60 min,2026-05-21,Kimi landed cost_panel() helper + /v2/cost-panel route + _snapshot() v2.cost embed + tests; commit pending
COORD-RUN-DRY-RUN,Operator-UX,harness coord run --dry-run prints plan + worker assignments without dispatching,shipped,Claude inline,45 min,2026-05-21,coord_run --dry-run short-circuits to planner output + would-be worktree paths; no Coordinator instantiation; 2 tests; commit pending
AUTO-QUARANTINE-KEY,Security,Proxy circuit-break 3x within 1h auto-writes quarantine record + escalation,shipped,Claude inline,60 min,2026-05-21,KeyState.circuit_trip_history + auto_quarantined_at fields; _detect_flap helper + transition() flap branch in circuit.py; 8 tests; commit pending
SPEC-LINT,Dispatch-Quality,harness lint-spec <spec.md> validates spec for plan-readiness before dispatch,shipped,Kimi via swarm,60 min,2026-05-21,Kimi landed src/harness/lint.py + top-level harness lint-spec verb + 9 tests covering all 5 LintFinding codes; commit pending
RUN-TAG-LABEL,Operator-UX,--label <tag> on coord run + retrieval via coord list --label,shipped,Claude inline,45 min,2026-05-21,RunState.label field + Coordinator label kwarg + list_runs(label=) filter + coord_list LABEL column + /v2/runs?label=X query param; 5 tests; commit pending
FIRST-RUN-DOCTOR,Onboarding,harness doctor — single-command preflight (git+DPAPI+secrets+perms+TaskSched+engines),shipped,Kimi via swarm,75 min,2026-05-21,Kimi landed doctor.py with 6 checks + traffic-light CLI + 8 tests; commit pending
DISK-FULL-GUARD,Failure-Mode,Pre-flight disk space + write-fail rollback on commit,shipped,Claude inline,60 min,2026-05-21,store.write_status: 10MB free floor + .bak rotation + post-replace SHA verify + restore-from-bak on corruption detection; 9 tests
PROXY-RESET-DOCS,Failure-Recovery,harness proxy unquarantine <key>|--all + recovery docs covering all 4 disable states,shipped,Kimi via swarm,45 min,2026-05-21,Kimi landed unquarantine helper + harness proxy unquarantine verb + spec/proxy-recovery.md 4-state map + 6 tests
PANIC-DUMP,Operator-UX,harness panic-dump single-command state snapshot tarball,shipped,Kimi via swarm,60 min,2026-05-21,Kimi landed src/harness/panic.py with secret scrubbing + tarball builder + 7 tests
SWARM-LANDING-VERIFY,DX,harness swarm verify-landings (port warehouse parse-swarm-status pattern),shipped,Kimi via swarm,60 min,2026-05-21,Kimi landed src/harness/swarm_verify.py + harness swarm-verify CLI verb + 9 tests; falsifies the timeout=failed assumption per feedback_kimi_cli_incremental_edits
BATTLE-TEST-WORKER-SWARM-ROUTE,Production,worker.run_worker shells out to xaxiu-swarm for swarm/* engines,shipped,Claude inline,30 min,2026-05-21,Battle-test #1 — dispatch_packet rejected "swarm/kimi" force_engine; added _dispatch_via_swarm subprocess routing. Every prior real worker run would have failed
BATTLE-TEST-ENGINE-INIT-FIX,Production,Engine ABC __init__(api_key) + derived name property,shipped,Claude inline,20 min,2026-05-21,Battle-test #4+5 — concrete classes referenced self._api_key without __init__; abstract `name` never implemented; factory threw TypeError on every real engine init
BATTLE-TEST-INJECTION-RELAX,Production,Remove api_key_literal false-positive from packet injection filter,shipped,Claude inline,15 min,2026-05-21,Battle-test #3 — naming env vars in a spec is not exfiltration; was blocking every legitimate spec that documents engine vars
BATTLE-TEST-KIMI-ENDPOINT-OVERRIDE,Production,KIMI_API_BASE_URL env override for international vs China endpoint,shipped,Claude inline,15 min,2026-05-21,Battle-test #7 partial — endpoint was hardcoded to api.moonshot.cn; allow override. 401 still observed against international — may need model rename or oauth shape fix in a follow-up
BATTLE-TEST-KIMI-CODE-ENDPOINT,Production,Default Kimi endpoint to kimi.ai (Kimi Code) + UA allowlist + KIMI_BASE_URL/USER_AGENT env overrides,shipped,Claude inline,30 min,2026-05-21,Operator's account is Kimi Code (api.kimi.com/coding/v1) not Moonshot Platform. Wrong endpoint+UA caused 401/403. Per reference_kimi_features_canonical memory. Real round-trip confirmed working
BATTLE-TEST-PLANNER-COMPACT-SCHEMA,Production,Replace WavePlan.model_json_schema() in planner prompt with hand-rolled compact example,shipped,Claude inline,30 min,2026-05-21,Battle-test #8 — full Pydantic JSON schema (4.8KB) caused Kimi server disconnect mid-response. Compact example (~1.5KB) + field-rules text gets clean JSON back. Tests still green
BATTLE-TEST-CONCRETE-BOUNDARY-TESTS,Hygiene,Update concrete-boundary tests for new Kimi endpoint + UA defaults,shipped,Claude inline,15 min,2026-05-21,Updated KIMI_URL constant + UA assertion to match new defaults; 27 tests pass
COORD-RUN-RUNBOOK,Documentation,spec/coord-run-runbook.md end-to-end walkthrough with mock engine,shipped,Claude inline,75 min,2026-05-21,spec/coord-run-runbook.md with 5-min first-run + state diagram + artifact-location table + 13-row recovery cheat-sheet
CHANGELOG-V05,Documentation,CHANGELOG.md v0.5 entry covering 47-row + 18-commit autonomous session,shipped,Claude inline,45 min,2026-05-21,CHANGELOG.md groups commits by Phase 4/5/6 + Integration wires + Hygiene; references every STATUS row id; documents the no-premature-stop mechanism
ADAPTER-CREATE,DX,harness adapter create <project-name> scaffolding verb,shipped,Kimi via swarm,60 min,2026-05-21,Kimi landed src/harness/adapters/scaffold.py + harness adapter create CLI verb + 6 tests; resolves PROJECT_ROOT placeholder per template
PACKET-INJECTION-FILTER,Security,Outbound packet content scanner before dispatch,shipped,Claude inline,45 min,2026-05-21,scan_packet_for_injection in dispatcher.py covers 7 patterns; refuses with packet_injection_blocked; HARNESS_ALLOW_UNSAFE_PACKETS=1 bypass; 12 tests; commit pending
LOCK-COORD-DIR,Multi-Tenancy,File-lock coord/ writes when 2 sessions detected,shipped,Kimi via swarm,60 min,2026-05-21,Kimi landed coord/lockfile.py + StateLockTimeout error + file_lock CM with stale-detection (30s) + 5 tests; stdlib-only, no portalocker dep; commit pending
DB-CORRUPT-RECOVERY,Failure-Mode,SQLite integrity_check on boot + auto-restore from snapshot,shipped,Kimi via swarm,45 min,2026-05-21,Kimi landed _is_db_corrupt + _move_aside_corrupt + _restore_from_snapshot + _take_snapshot + init_db auto-recovery + 8 tests; commit pending
ENGINE-COST-LEDGER-EXPORT,Telemetry,Daily cost CSV export to coord/cost_daily/,shipped,Kimi via swarm,45 min,2026-05-21,Kimi landed export_daily_csv in budget.py + harness budget export-daily CLI verb + 4 tests; commit pending
